228,3196205720,工资,2022/6/23 14:09,https://weibo.com/3196205720/Lz5ZTqN20?refer_flag=1001030103_,3196205720,4.78E+15,的笃的笃的笃,0,2,0,nan,nan,谁能想到我都被职场pua了呢[失望]2022年了竟然还听得到上班不能只为了钱还要有价值观和成就感这样的话??那你要什么工资啊直接签卖身契不就行了,2013/2/22 15:17
241,5614458696,工资,2022/6/23 14:09,https://weibo.com/5614458696/Lz5ZFgXub?refer_flag=1001030103_,5614458696,4.78E+15,该用户正在发财财财财,0,0,1,nan,nan,每天都不舍得开空调都是开到睡觉前再换风扇所以这个月工资什么时候发[伤心][泪],2015/5/23 18:03
101,6491417379,工资,2022/6/23 14:08,https://weibo.com/6491417379/Lz5ZolUse?refer_flag=1001030103_,6491417379,4.78E+15,_叁叁而川_,0,0,0,nan,nan,警察荣誉，派出所民警的琐碎日常，真是所有的基层人民都不容易啊。看到有一集李大为发现了歹徒没有汇报，自己拉着985辅警去抓人。让所长好顿批。特别是那句台词“一个辅警，一个月两千多块钱工资，你想让人家把命搭上”。看到这句台词，就会感觉那些只管自己手头，不管别的工作都是正常的。起码这些人,2018/2/19 23:40
370,1245495240,工资,2022/6/23 14:08,https://weibo.com/1245495240/Lz5ZeBPHW?refer_flag=1001030103_,1245495240,4.78E+15,Lee解不了,0,0,0,nan,nan,其实不是什么特殊的日子，只是忽然emo。前阵子和我妈唠嗑，说现在油价涨成这样，我爹要是还在高低得想买个电车玩玩，刚好旧车破的不能开已经卖了，他要是买估计还就认特斯拉买。我妈表示同意。我爹年轻的时候是位个子不高的帅哥，爱干净性格乐观，有点固执，喜欢追新潮，攒几个月工资买随身听，,2009/9/14 22:03
54,6403504310,工资,2022/6/23 14:04,https://weibo.com/6403504310/Lz5XLirou?refer_flag=1001030103_,6403504310,4.78E+15,顾姐姐嘿,0,0,0,nan,nan,没有一份工作不委屈，培养“滚刀肉”精神。看过一句话，你的工资里，本来就有一部分是支付给你的委屈费。每个试图努力生活的人，都受过工作的委屈，挨过生活的耳光。,2017/11/5 13:33
178,1848574332,工资,2022/6/23 14:04,https://weibo.com/1848574332/Lz5XvojPK?refer_flag=1001030103_,1848574332,4.78E+15,skyblue_wd,0,0,0,nan,nan,今日劳动法主厨小菜——计件工资亦应按照150%、200%、300%计算加班工资[酷],2011/9/15 11:44
437,5329319504,工资,2022/6/24 14:50,https://weibo.com/5329319504/LzfGNmOp7?refer_flag=1001030103_,5329319504,4.78E+15,Sisley--L,2,86,43,"vip陪练,vip陪练压榨老师,VIP陪练倒闭",vip陪练vip陪练压榨老师VIP陪练倒闭,小红书商科人笑死我了，20w人民币换完汇率一年工资4w多刀，一个月工资没打税3000多在这说啥呢……,2014/10/13 23:31
4675,3170193192,工资,2022/6/24 14:44,https://weibo.com/3170193192/LzfEttB8c?refer_flag=1001030103_,3170193192,4.78E+15,酯英俊,1,3,1,nan,nan,发了一千二百多[下雨]粗略算来应该是二百多[生病]仔细算来，这次应该是负的工资????,2013/1/27 0:58
3047,1748157225,工资,2022/6/24 14:38,https://weibo.com/1748157225/LzfBWgsYF?refer_flag=1001030103_,1748157225,4.78E+15,Uki是乖孩子,0,0,3,nan,nan,每个月的工资怎么那么难等！！！！,2010/5/29 14:15
221,3563504391,工资,2022/6/24 14:38,https://weibo.com/3563504391/LzfBTBR0H?refer_flag=1001030103_,3563504391,4.78E+15,爱吃铁锅炖炖,1,2,0,nan,nan,果然还是毛茸茸能安抚[心]无数次冲动想养他们等我有了工资，立马带一只毛茸茸回家[鼓掌],2013/6/28 17:43
1665,3832925011,工资,2022/6/24 14:36,https://weibo.com/3832925011/LzfB80n9M?refer_flag=1001030103_,3832925011,4.78E+15,就是记性差怎样嘛,0,5,3,nan,nan,虽然今天好累好累除了暖心空的可爱多还有美自拍和发工资哦[哇],2013/10/5 12:37
316,1813109193,工资,2022/6/24 14:33,https://weibo.com/1813109193/LzfzP2rKw?refer_flag=1001030103_,1813109193,4.78E+15,美婷ing丶,0,5,1,nan,nan,等他们吃完饭补昨天的图1.最近的工作状态周四的调度表和每月汇总撞一起今天周五忙了一整天两点半到四点，本来四点完，四点半结束完就赶紧走了2.哈，工资到账虽然不多，再接再厉3.哈哈，我说不用开空调了有点背疼他们就没有开，热了去党委办公室呆着每次媛媛都要说一句，团宠啊45.他们给我,2010/9/16 21:30
67,6657737670,工资,2022/12/1 14:56,https://weibo.com/6657737670/MhCEnq29T?refer_flag=1001030103_,6657737670,4.84E+15,退伍老兵大刚,0,0,2,nan,nan,什么时候才能发工资啊！想消费[泪][泪],2018/8/24 21:48
1,5705786264,工资,2022/12/1 14:55,https://weibo.com/5705786264/MhCDS5Jws?refer_flag=1001030103_,5705786264,4.84E+15,穿越山海小精灵,0,0,0,nan,nan,妈耶我也太好看了吧/事实是差点没给我抽死/工资回流了属于是[微笑],2015/9/18 9:24
392,3170069357,工资,2022/12/1 14:55,https://weibo.com/3170069357/MhCDQ63SK?refer_flag=1001030103_,3170069357,4.84E+15,火锅涮小狗,0,0,0,nan,nan,工资两千八每天乐哈哈[挤眼],2013/1/21 16:13
1743,1860962312,工资,2022/12/1 14:50,https://weibo.com/1860962312/MhCC23k84?refer_flag=1001030103_,1860962312,4.84E+15,考拉景66所求皆成,0,0,1,国美电器已被申请破产清算,国美电器已被申请破产清算,目前工资卡上的钱还信用卡和花呗还欠30元[允悲][允悲]我为什么把日子过成这样了,2010/10/23 21:39
31,3059373013,工资,2022/12/1 14:26,https://weibo.com/3059373013/MhCs3kQah?refer_flag=1001030103_,3059373013,4.84E+15,Let_YouGo,0,0,0,nan,nan,当我说工资??一直都没发，过年也够呛能发的时候，只有我姥问我那你手里还有钱吗？我这有……我说不用，够花，你留着过年吧，我姥说过年怎么都能过，有就多花点，没有就少花点呗……泪奔，不知道为啥，今天就想哭[泪],2012/10/23 15:29
349,5648540682,工资,2022/12/1 14:21,https://weibo.com/5648540682/MhCq5iz7Q?refer_flag=1001030103_,5648540682,4.84E+15,爱看稿的黄色拉拉小兔纸,0,0,4,nan,nan,十二月一日的第一份快乐是发了三个月的工资??????[送花花][送花花][送花花],2015/7/9 17:42
187,3320234792,工资,2022/12/1 14:13,https://weibo.com/3320234792/MhCn0kQWr?refer_flag=1001030103_,3320234792,4.84E+15,赣州市信丰县新田镇百石小学,0,0,0,nan,nan,希望单位那些高中都还没毕业的人不要再纠结为什么我工资比你们高了行吗[二哈]http://t.cn/A6KVXmXW,2013/4/12 15:04
71,5387233312,工资,2022/12/1 14:06,https://weibo.com/5387233312/MhCjY8mzT?refer_flag=1001030103_,5387233312,4.84E+15,微无拘无束,0,0,0,nan,nan,[苦涩][苦涩][苦涩]工资少的可怜。[苦涩][苦涩][苦涩],2014/11/25 15:31
870,1378436361,工资,2022/12/1 14:04,https://weibo.com/1378436361/MhCj893Sm?refer_flag=1001030103_,1378436361,4.84E+15,紫璃272,0,0,0,nan,nan,10月份干的那厂化妆品厂，疫情防控3年多，第一次经历待在厂里封闭管控5天。不能回家。在那干了几天才收到消息，拖欠工资，所以只干了20天就辞工，本来想着可以等着11月份月底发工资的。万万没想到，那个厂11月中突然宣布倒闭（厂里的人好多都说打工这么多年第一次遇到这种情况呢，我也是打工生涯里第一,2011/12/20 10:35
122,5045911354,工资,2022/12/1 13:57,https://weibo.com/5045911354/MhCgkkFw1?refer_flag=1001030103_,5045911354,4.84E+15,人类永生计划,0,0,0,nan,nan,当发工资的第一时间你想去分享你的快乐精心挑选礼物做惊喜还沉浸在快乐当中时，一个从来不转账的人发了红包并又转账之后才确认“发送好友验证”,2014/2/22 8:14
704,5639978006,工资,2022/12/2 14:55,https://weibo.com/5639978006/MhM4kibV8?refer_flag=1001030103_,5639978006,4.84E+15,想胖卿卿,0,0,2,nan,nan,以前上班两年半没有因为工作额外花费半毛钱现在这个破工作工资低还额外花钱开会员打印教具越想越生气??,2015/6/25 13:38
154,5065174078,工资,2022/12/2 14:53,https://weibo.com/5065174078/MhM3R6np8?refer_flag=1001030103_,5065174078,4.84E+15,Hey一口芝士,0,0,0,nan,nan,11月19号休息到12月10号才休息[抓狂]苦不堪言，身心疲惫，有苦有累说不出的那种心酸，不是一般人真的能承受得了[抓狂]1:前段时间疫情期间到处封村封路从而导致物流进不来，现在整个广州都解封了，所以拼命来货，昨天214件衣架，今天400件一次性碗[抓狂][抓狂][抓狂]做死人不偿命[晕][晕][晕]2:前几,2014/3/9 13:50
733,5643499193,工资,2022/12/2 14:53,https://weibo.com/5643499193/MhM3z3Lvp?refer_flag=1001030103_,5643499193,4.84E+15,Happy的謝崗菇涼,0,0,1,nan,nan,今天拿到了惊喜工资，竟然比平常足足多了二千多耶！！！爱钱如我，希望惊喜变成日常??[给力][给力][给力]#卡塔尔世界杯#,2015/7/1 15:37
45,5442602142,工资,2022/12/2 14:41,https://weibo.com/5442602142/MhLYPihOk?refer_flag=1001030103_,5442602142,4.84E+15,草莓兔角包,0,0,0,nan,nan,看到工资条了坐锅里都捂不热我的心人还是要好好去上班不然根本不知道睡到自然醒有多开心,2014/12/21 18:21
134,2181435257,工资,2022/12/2 14:38,https://weibo.com/2181435257/MhLXw4YZb?refer_flag=1001030103_,2181435257,4.84E+15,今年改不改名字了呢,0,1,0,nan,nan,1、打工只是为了去积累一定的试错成本，想要改命，不断去尝试才是最佳的途径，而不是拿着死工资过生活。2、多年以来从学校学的的那套普世价值观，完美地避开了赚钱，避开了改命这一条道路。对于寒门出身的孩子而言，你接收的很可能不是十几年的教育，而是十几年教育的伤害。3、赚钱的本质是收钱，收,2011/6/16 8:47
127,5837922023,工资,2022/12/2 14:28,https://weibo.com/5837922023/MhLTF0JMe?refer_flag=1001030103_,5837922023,4.84E+15,特立独行的猪008,0,0,0,nan,nan,在坚持两天就要发工资了??[哇]l,2016/1/24 19:10
383,3648955423,工资,2022/12/2 14:23,https://weibo.com/3648955423/MhLRtB1wI?refer_flag=1001030103_,3648955423,4.84E+15,甜豆mile,0,0,1,nan,nan,三千的工资，八百个群,2013/8/14 0:55
512,2342853862,工资,2022/12/2 14:13,https://weibo.com/2342853862/MhLNtFUAF?refer_flag=1001030103_,2342853862,4.84E+15,浅浅浅浅二,0,0,0,nan,nan,真烦，加班到现在[揣手]算农民工的工资算的心烦[丰收了][丰收了][丰收了],2011/8/25 23:07
424,2037503815,工资,2022/12/2 14:07,https://weibo.com/2037503815/MhLLdlDMJ?refer_flag=1001030103_,2037503815,4.84E+15,Liu_Zzzzzzzz,0,25,4,nan,nan,ok发工资之前停止消费！剁手ing！,2011/3/21 11:01
212,2061727574,工资,2022/12/2 13:58,https://weibo.com/2061727574/MhLHstEN8?refer_flag=1001030103_,2061727574,4.84E+15,江湖不急喵,0,0,0,nan,nan,现在才有空想着发微博这几天就像上了发条，一直忙一直忙[晕]可是明明工资才几千块，为什么要这么敬业呢[doge]还是过不了自己那一关吧，做不好就会担心得睡不着终于吃到了鸡煲了，可是不完美，是想吃五指毛桃汤底，碳炉鸡煲的，刚好网红店有开，可是去到了人多又闷旁边又抽烟，就剩下一张边边角角的,2011/5/22 19:16
4910,1753096023,工资,2022/12/2 13:54,https://weibo.com/1753096023/MhLFApgfk?refer_flag=1001030103_,1753096023,4.84E+15,新叶天天长老--李日新,0,0,0,美元指数,美元指数,发工资也感受不到一丝高兴，为了攒钱买房装修，这几年啥都不敢买，紧衣缩食。加油吧！(???_??)?,2011/5/30 10:52
194,2426381367,工资,2022/12/2 13:52,https://weibo.com/2426381367/MhLF01ozt?refer_flag=1001030103_,2426381367,4.84E+15,发芽的木头君,0,0,0,nan,nan,用赚来的工资花钱是最爽的???,2012/6/13 11:14
36,6542022727,工资,2022/12/2 13:50,https://weibo.com/6542022727/MhLE4tsK9?refer_flag=1001030103_,6542022727,4.84E+15,一颗不会发光的星星123,0,0,0,nan,nan,今天发工资啦，随时有点少，但是还是很开心，嗯嗯，有点后悔自己没有认真的选择和学习一个好的专业，没有一技之长，和我同龄的同事比我工资要高许多，加油吧,2018/5/5 11:08
498,1146766514,工资,2022/12/2 13:48,https://weibo.com/1146766514/MhLDotFnX?refer_flag=1001030103_,1146766514,4.84E+15,朱恒馨,0,0,0,nan,nan,莫名的有压力，怕管控的太久不上班公司有正当理由不给工资，每天都好几百例不知道什么时候才能上班！,2010/5/26 12:47
203,1827621053,工资,2022/12/2 13:47,https://weibo.com/1827621053/MhLCXCr0G?refer_flag=1001030103_,1827621053,4.84E+15,showtom,0,3,0,nan,nan,每天打工赚到工资不够一天吃饭的,2010/10/9 12:12
217,3802930523,工资,2022/12/2 13:46,https://weibo.com/3802930523/MhLCxf7jM?refer_flag=1001030103_,3802930523,4.84E+15,贾开心很开心,0,0,0,nan,nan,真的尽心尽力去教了，加班给他们审工资表回到宿舍累趴,2013/9/18 22:32
260,2821972093,工资,2022/12/3 14:53,https://weibo.com/2821972093/MhVu7sqgr?refer_flag=1001030103_,2821972093,4.84E+15,无事小神先,0,0,2,nan,nan,感觉互联网冲浪久了真真觉得自己配不上这个时代…假设月薪1w，那年薪就是12w（我觉得在普通人范畴里算是个还不错的工资了吧），一年严格控制消费，攒下10w（我觉得挺难做到…）那得十年才能攒到100w，而十年攒下的钱是明星一个月的开销…好累啊5555,2012/6/19 20:16
549,1761798875,工资,2022/12/3 14:51,https://weibo.com/1761798875/MhVtf32OM?refer_flag=1001030103_,1761798875,4.84E+15,大米河虾,0,0,0,nan,nan,悲伤的消息。没有工资发[单身狗]还要等很久很久,2010/9/16 12:24
23,6357652544,工资,2022/12/3 14:49,https://weibo.com/6357652544/MhVsBq1ya?refer_flag=1001030103_,6357652544,4.84E+15,小姐姐的萌萌哒清纯无敌双马尾,0,0,0,nan,nan,猪队友从结婚前开始时不时被提及的换驻地工作，这一天还是来临了，很快就要被迫成异地夫妻了虽说领导有特许一个月能回来一周，但真正执行不知道怎么样，加上yi情，更说不准无奈，小地方赚不到啥钱，冲着双倍工资只能忍着两三年先了，只是希望等鹅子大点懂事了还是能有爸妈一起陪在身边我也被迫,2017/8/30 22:59
262,3675304860,工资,2022/12/3 14:48,https://weibo.com/3675304860/MhVsczyXW?refer_flag=1001030103_,3675304860,4.84E+15,11点前要睡觉ii,0,0,0,nan,nan,啊啊啊啊，好想吃垃圾食品！！！等解封了我要花光这个月的工资去吃炸鸡汉堡薯条火锅烧烤麻辣烫麻辣香锅披萨烤肉螺蛳粉蛋糕冰淇淋奶茶！！！,2013/7/30 8:45
272,2471817540,工资,2022/12/3 14:48,https://weibo.com/2471817540/MhVs74sN1?refer_flag=1001030103_,2471817540,4.84E+15,小蘐籽,0,2,1,nan,nan,《你一个月工资就三千块！》[苦涩],2011/10/16 16:23
117,6017107161,工资,2022/12/3 14:41,https://weibo.com/6017107161/MhVpvmX4L?refer_flag=1001030103_,6017107161,4.84E+15,路上有只熊睡觉了,0,0,4,近一半研究生因缺钱想弃学,近一半研究生因缺钱想弃学,明天收拾行李~??听说假期工资照样有[钢镚儿],2016/9/5 19:29
2427,2873816854,工资,2022/12/3 14:32,https://weibo.com/2873816854/MhVlAvr85?refer_flag=1001030103_,2873816854,4.84E+15,1荔今晚不吃了,0,0,3,近一半研究生因缺钱想弃学,近一半研究生因缺钱想弃学,破防了上班点杯奶茶20用了我四十分钟工资[开学季],2012/7/18 15:31
216,5705697605,工资,2022/12/3 14:27,https://weibo.com/5705697605/MhVjOf8H3?refer_flag=1001030103_,5705697605,4.84E+15,不被风吹的树,0,0,0,nan,nan,今天是完美的一天！见了矮子！吃了蛙蛙！办好了工资卡！写好了网评！[赢牛奶][赢牛奶],2015/9/17 16:32
263,3188156204,工资,2022/12/3 14:11,https://weibo.com/3188156204/MhVdjwZYn?refer_flag=1001030103_,3188156204,4.84E+15,驱征马而不顾,0,0,0,nan,nan,一个月125万工资，一年1500万经济学家，研究出1.98万亿负债，这个相当有难度！,2013/2/12 10:50
1058,1739092192,工资,2022/12/3 14:04,https://weibo.com/1739092192/MhVauxNZZ?refer_flag=1001030103_,1739092192,4.84E+15,Honeyaioria_fish,0,0,2,nan,nan,我好肤浅我的快乐需要不停的购入漂亮衣服维持我好菜鸡工资根本不够购入，更别提不停的购入,2010/5/8 9:24
251,1933362403,工资,2022/12/3 13:58,https://weibo.com/1933362403/MhV7Kq4aG?refer_flag=1001030103_,1933362403,4.84E+15,一个怨,0,0,0,nan,nan,实习期一个月1000，之后转正也就2500，两三年后才能上升涨涨工资，审计这行还能不能干了#审计#,2011/1/24 21:41
102,5661213441,工资,2022/12/3 13:43,https://weibo.com/5661213441/MhV1TdfKP?refer_flag=1001030103_,5661213441,4.84E+15,梨花淡酒,0,0,0,nan,nan,12月3日，几乎睡了一整天，当然也没怎么吃饭，习惯很差又改不过来，主要是懒。懒得换衣服下楼去菜市场买想了很久的明虾和清远鸡，懒得买回家之后开锅烹煮洗碗收拾。新冠真是善解人意，下午梦一场醒来还在纠结，就看到小区群里“东康菜场封闭”的消息。希望新冠再善解人意一点，虽然百年一遇，但人类真,2015/7/25 15:34
488,1884367274,工资,2022/12/3 13:41,https://weibo.com/1884367274/MhV16a9Ki?refer_flag=1001030103_,1884367274,4.84E+15,花花顾花花,0,2,0,nan,nan,每天做着毫无意义的工作还要感谢能给我发工资接地球毁灭????,2010/12/2 13:17
248,2723034623,工资,2022/12/4 14:56,https://weibo.com/2723034623/Mi4VSymLp?refer_flag=1001030103_,2723034623,4.84E+15,多么wa噻的姑娘,1,4,4,nan,nan,工作内容千变万化，工资一成不变的工作，做着真累，把这些精力花在做一件事情上，可能已经小有成就了。,2012/4/29 20:28
530,2256416497,工资,2022/12/4 14:56,https://weibo.com/2256416497/Mi4VK1zam?refer_flag=1001030103_,2256416497,4.84E+15,寒千羽同学,0,0,0,nan,nan,2022.12.04wcy说以后上班挣钱工资上交全都给我花,2011/7/19 10:48
421,1693105130,工资,2022/12/4 14:45,https://weibo.com/1693105130/Mi4RqBbjj?refer_flag=1001030103_,1693105130,4.84E+15,狂奔de骆驼,0,0,0,nan,nan,??日常记幸福的点总是没来由会来撩拨你一下，-就比如今天下午从家回来租房的路上，突然就想喝奶茶，碰巧顺路边上就有这样一家店，骑着车载着满是’食物’的行李箱手里拎着热奶茶那一路心里都是暖暖的～-天越来越冷了…-工资照发的话，我是最擅长宅的！【复盘双十一】女生的化妆品其实一点都不,2010/2/11 22:20
182,6556779007,工资,2022/12/4 14:34,https://weibo.com/6556779007/Mi4MUsxRO?refer_flag=1001030103_,6556779007,4.84E+15,一位不愿透露名字的魔法少女,0,0,0,nan,nan,厂里的女工说小孩子最累，她们只是身体累，小孩是精神累，其实我们镇已经有家长选择躺平了，毕竟小镇工人工资还挺高的，累是累点，一个月都有万把左右，厂里还交社保。,2018/5/23 11:12
1244,2792417650,工资,2022/12/4 14:34,https://weibo.com/2792417650/Mi4MPtm7K?refer_flag=1001030103_,2792417650,4.84E+15,无末-绘,0,0,0,nan,nan,今天发工资，我以为会按照自己预想的业绩来算提成，然后真的结算工资的时候，现实与假设更离谱，是我美好了，无情最是资本家,2012/5/2 12:09
92,5128444612,工资,2022/12/4 14:29,https://weibo.com/5128444612/Mi4KY9rtd?refer_flag=1001030103_,5128444612,4.84E+15,Franseanfly-,0,2,0,nan,nan,今天晚上儿子又来电话啦，我问儿子：“最近回来吧？我好报备”儿子告诉我：“他们学校暂时还没放假，还得在学校待一阵子呢，儿子还说正好这段时间在学校写论文”[鼓掌]最后儿子又告诉我，他已经和南方城市一个公司签了工作协议啦，工资待遇还不错????,2014/10/25 18:50
727,6630480591,工资,2022/12/4 14:29,https://weibo.com/6630480591/Mi4KT83QF?refer_flag=1001030103_,6630480591,4.84E+15,春暖花开6630480591,0,16,11,nan,nan,我要攒工资！买AppleWatch！,2018/8/10 18:53
101,2410552134,工资,2022/12/4 14:25,https://weibo.com/2410552134/Mi4JpwOVU?refer_flag=1001030103_,2410552134,4.84E+15,澹眠春深,0,0,0,nan,nan,[苦涩]从口罩突然严重同事基本都忙忙碌碌的住在单位而我也过上了没有周六周日的日子..每天睁开眼就是整理数据[苦涩]我的小脑袋瓜子要每天核对好多遍才敢发给领导..面对领导的每一次灵魂拷问都使我神经紧张[苦涩]求求疫情赶紧过去吧..我在家的这段日子里..缩水的除了我的衣服还有我的工资[苦涩],2011/9/19 23:57
4296,2607431501,工资,2022/12/4 14:24,https://weibo.com/2607431501/Mi4IZB2fU?refer_flag=1001030103_,2607431501,4.84E+15,玉玉玉玉玉玉皎Aa,0,0,0,nan,nan,我现在越来越明白活着的意义就是舒心做适合自己的事情和可以让你开心的人在一起不去内耗自己人生太短了所以该努力时努力该享受时享受如果十二月工资上万的话就奖励自己洱海或者澳门游[偷笑][偷笑][偷笑]fighting！！,2012/1/24 22:00
237,3229405602,工资,2022/12/4 14:24,https://weibo.com/3229405602/Mi4IJiIKd?refer_flag=1001030103_,3229405602,4.84E+15,阿聿Ufoabiacaf,0,0,0,nan,nan,只有发工资能让我开心了。期待下周五,2013/3/20 20:25
447,5792894551,工资,2022/12/4 14:18,https://weibo.com/5792894551/Mi4Gs1U17?refer_flag=1001030103_,5792894551,4.84E+15,叫我梵高好了,0,4,2,腾讯文档,腾讯文档,我也想说??怎么又值班??今日工资：N95一个。,2015/12/14 22:14
571,1748322032,工资,2022/12/4 14:18,https://weibo.com/1748322032/Mi4GpDNB4?refer_flag=1001030103_,1748322032,4.84E+15,庚欣209,0,9,1,nan,nan,哦莫哦莫，最近又在想明年还来不来广州了[失望]可是在家又能做什么工作啊？还要面对一些人际关系。虽然在家有空着的4楼可以住，但是我又不能保证家人能够给我足够的自由，加上相亲和催婚[二哈]在广州的话，除了自由，要租房，工作不稳定，工资低也赚不到钱啊[失望][失望],2010/5/29 19:13
717,1686291137,工资,2022/12/4 14:17,https://weibo.com/1686291137/Mi4G7lOdR?refer_flag=1001030103_,1686291137,4.84E+15,在喜茶门口喝茶颜悦色,0,2,0,nan,nan,浪费三百块就三百块吧，所以说一个月工资怎么存下钱？又要买衣服又要吃饭、,2010/1/25 16:08
204,5590841577,工资,2022/12/4 14:15,https://weibo.com/5590841577/Mi4FbdB40?refer_flag=1001030103_,5590841577,4.84E+15,麦孔沃博MAQVOB,0,0,0,nan,nan,小张说发了年终奖给我一个月的工资买包，之前想过年的时候就可以拥有自己第一个奢侈包包了，但是现在不上班了以后感觉包包的使用频率大幅下降，又看到网上说lv可能会涨价[苦涩]好纠结，本来想过年不买就生完宝宝奖励自己，小张能接受涨价后的价格，但是我自己却不接受，好纠结啊[泪]有钱就不会纠结了,2015/4/18 12:19
1994,1876613851,工资,2022/12/4 14:15,https://weibo.com/1876613851/Mi4F44OAh?refer_flag=1001030103_,1876613851,4.84E+15,游在瑞典,0,0,0,nan,nan,日复一日周复一周下周的盼头就是发工资啦,2010/11/28 7:58
250,6151969730,工资,2022/12/4 14:12,https://weibo.com/6151969730/Mi4EeCvYX?refer_flag=1001030103_,6151969730,4.84E+15,揪星嘉的米子,0,15,1,nan,nan,其实只有发工资那几天零下。后面温度就正常了，但是为了避免麻烦，我还是把袜子买了吧，,2017/3/6 16:29
380,2422921671,工资,2022/12/4 14:02,https://weibo.com/2422921671/Mi4A1akQK?refer_flag=1001030103_,2422921671,4.84E+15,Kono乔Dio哒,0,2,10,nan,nan,这四天跟做梦一样深入有钱人生活的世界体验了一把整理服务第一天当一天的袜奴，女儿房的袜子，多到难以形容第二天叠针织衫叠到手软，圆领，V领，高领，深色，浅色，短袖，长袖。还有混入其中的秋衣……第三天爱马仕围巾丝巾叠花了眼，我这辈子都没想到有一天能摸一整天的爱马仕。第四天当了足足,2011/10/22 22:22
71,5387233312,工资,2022/12/4 13:56,https://weibo.com/5387233312/Mi4xGB3Gl?refer_flag=1001030103_,5387233312,4.84E+15,微无拘无束,0,0,0,nan,nan,发工资=换手机所以啥时候发工资[泪],2014/11/25 15:31
112,3694987142,工资,2022/12/4 13:56,https://weibo.com/3694987142/Mi4xBj9Ud?refer_flag=1001030103_,3694987142,4.84E+15,kouayouayou,0,0,0,nan,nan,看见工资??一个月的努力??值了[哈哈][哈哈][哈哈],2013/8/3 21:41
54,2207270011,工资,2022/12/4 13:56,https://weibo.com/2207270011/Mi4xwyhv0?refer_flag=1001030103_,2207270011,4.84E+15,吴乐乐765,0,0,0,nan,nan,现在是周日晚上从下午开始一直被甲方叫改图今天是周日没付我工资我法定内休息时间凭什么叫我待命凭你那几块钱的工资吗,2011/6/29 9:05
883,3577688575,工资,2022/12/4 13:50,https://weibo.com/3577688575/Mi4vc5UZV?refer_flag=1001030103_,3577688575,4.84E+15,聪明俞,0,2,0,nan,nan,梦幻世界里的吸血套路：吸血鬼发工资，你给他干活，然后，工资发下来，接应吸血鬼就上来了，开始找你借钱，介绍婚恋抽油水，把大部分的钱又吸去了，无声无息，难以察觉，非常隐秘的吸血鬼合作套路,2013/7/3 21:05
6,6598480852,工资,2022/12/4 13:49,https://weibo.com/6598480852/Mi4uQyJ2p?refer_flag=1001030103_,6598480852,4.84E+15,雨碎江南7,0,0,0,nan,nan,但是仔细想想这个月上到二十一号是不是就发工资了哈哈哈哈哈哈,2018/7/12 12:42
47,5536477891,工资,2022/12/5 14:59,https://weibo.com/5536477891/Mienxh4Ot?refer_flag=1001030103_,5536477891,4.84E+15,富贵_er_,0,0,1,nan,nan,真是离了大谱滑稽至极拖欠工资找领导预支还算欠债真是开了眼啊[吐][吐],2015/2/27 23:11
343,5268360708,工资,2022/12/5 14:49,https://weibo.com/5268360708/MiejChPSp?refer_flag=1001030103_,5268360708,4.84E+15,惠酱没睡醒,0,0,1,nan,nan,小红书是懂大数据的天天给我推建议低工资女孩考AA考BB考CC,2014/8/26 17:47
