602,1705333161,工资,2023/1/2 14:22,https://weibo.com/1705333161/Mmu6qqFjp?refer_flag=1001030103_,1705333161,4.85E+15,書-玍-孔乙魢,0,0,0,nan,nan,这几天累惨了每天早出晚归都没来得及在家里吃饭跟小崽子花了半个月工资买了个乐高跟肉肉买了变形金刚闹闹有了她的第一个乐高是她喜欢的小黄鸭她第一眼看到的时候好开心的说着鸭鸭自己在那拼玩了好久还跟闹闹买了新衣服今天去逛了一天灯人被掏空钱也被掏空了终于可以躺床上休息了闹闹还,2010/3/5 16:21
209,2384553640,工资,2023/1/2 14:20,https://weibo.com/2384553640/Mmu5ypulr?refer_flag=1001030103_,2384553640,4.85E+15,糜了鹿ya,0,0,0,nan,nan,神仙说《接纳》很多人感受不到幸福，对自己的能力不满意，对自己的收入不满意。是因为他们对自己的期望值太高了。我认识的一个女孩，每天到单位了之后，就是在不停的上网聊天，刷视频，领导安排的工作，什么都不想做，每个月发工资的时候却总是在抱怨自己的工资太少了，没有别人的工资高。其实每当,2011/9/9 18:46
193,6046127686,工资,2023/1/2 14:19,https://weibo.com/6046127686/Mmu57uXcx?refer_flag=1001030103_,6046127686,4.85E+15,神仙_2007,1,0,0,nan,nan,虫：你喜欢这个衣服吗？你买个手册塞！妈：没得钱。虫：你用你的工资买塞！妈：我工资要留到给你娶媳妇。虫：我又不娶媳妇，我要当一辈子单身狗。妈：你不娶媳妇我怎么抱孙子？虫：那你找人给我介绍嘛，我自己找不到。妈：你好好笑哦！虫：或者你给我定个娃娃亲也可以。,2016/10/16 0:45
246,5611496633,工资,2023/1/2 14:14,https://weibo.com/5611496633/Mmu3rpLAC?refer_flag=1001030103_,5611496633,4.85E+15,番茄小腾,0,0,0,nan,nan,如果说不管换谁化妆她都是最美的，那怎么不直接素颜出现？都比被拉垮的强吧？再有化妆师不能锦上添花，合作个p啊，拿着工资不干人事，丽是很漂亮，但是妆造也很重要好吗？合作那么多年有进取过吗？这么多次我就没见过对得起自己拿的工资的一次，要么发型拉垮，要么妆容拉垮，那么喜欢他，何必找别人？,2015/5/18 8:40
912,5048840404,工资,2023/1/2 14:13,https://weibo.com/5048840404/Mmu2Uleve?refer_flag=1001030103_,5048840404,4.85E+15,星星火焰,0,1,0,nan,nan,人工资一千八的都混上14了人跟人怎么差距这么大[泪],2014/2/25 8:49
1238,1676745204,工资,2023/1/2 13:59,https://weibo.com/1676745204/MmtXgto8Z?refer_flag=1001030103_,1676745204,4.85E+15,GUANGUAN_管管_,2,20,7,无锡医保,无锡医保,1-2面试了会计助理月薪1000明天上岗安慰自己是来学东西的，工资不多也没事其实可以再争取一下，加点工资单休也不太可能买了二手小电驴就花一千还没算吃饭真的贴钱实习有点怕怕怕自己入错行了没决定要干什么工作会计前景在哪工资够高吗还有国企外企三支一扶军队文职考公考编很多条路,2009/12/30 19:06
220,1024655850,工资,2023/1/3 14:59,https://weibo.com/1024655850/MmDLXiPe4?refer_flag=1001030103_,1024655850,4.85E+15,檀宫罗森业主,0,0,2,nan,nan,总裁转会后利雅得胜利的官方ins粉丝数激增至600余万，已经超过了罗马，埃弗顿，塞维利亚等欧洲俱乐部。截止发稿，网络平台预定销售的球衣收入已经超过1.7亿美元（根据欧洲俱乐部情况媒体推算利润约为45%）。著名的国际转播媒体商将在未来几天内与利雅得胜利谈判转播销售情况，预计也会带来超过一亿美元的收入#C罗[超话]#,2014/3/5 4:21
281,3152260564,工资,2023/1/3 14:56,https://weibo.com/3152260564/MmDKLFQCG?refer_flag=1001030103_,3152260564,4.85E+15,零售巨鳄千金,0,16,12,nan,nan,希望2023年每个月工资多发一些。手机内存动不动就满了，老是会出现一些bug，如果条件可以的的话，也想换个新的。,2013/1/18 21:53
114,2332941961,工资,2023/1/3 14:54,https://weibo.com/2332941961/MmDJSb55u?refer_flag=1001030103_,2332941961,4.85E+15,深海里的一滴蓝,0,0,0,nan,nan,请教一下劳动仲裁怎么弄事情是这样，我在去年9月入职了一家公司(老本行淘宝卖美容院用品的)，我主要干视频拍摄剪辑，没签劳动合同，没有五险一金社保(面试时老板有提前说没有买这个)，10月底换了另外一个办公地点，然后我在那租了房，4月底合同才到期。最近，公司生意不好，一开始提早放假，12月底部,2011/8/30 13:56
243,3393227282,工资,2023/1/3 14:46,https://weibo.com/3393227282/MmDGEE7tn?refer_flag=1001030103_,3393227282,4.85E+15,kucky明燕,0,0,0,nan,nan,别人的工资绩效都好高啊还有额外福利[苦涩]只有我工资低绩效也低，逢年过节也没有补助[苦涩]唉这个工作真是没有盼头[泪][泪],2013/4/30 22:07
25,6417465363,工资,2023/1/3 14:43,https://weibo.com/6417465363/MmDFt5IXi?refer_flag=1001030103_,6417465363,4.85E+15,列车员几好,0,0,1,"全国近94%县城房价不过万元,2023县城楼市何去何从",全国近94%县城房价不过万元2023县城楼市何去何从,看到大家都在说你，我就放心了[开学季]@吴宣仪的快乐碎片这段时间除了发发照片，发发几个月前的视频，还干了些啥啊[二哈]有些物料都不是你拍的吧…好意思拿工资吗？,2017/11/26 9:58
280,6570620170,工资,2023/1/3 14:39,https://weibo.com/6570620170/MmDE31h6Z?refer_flag=1001030103_,6570620170,4.85E+15,m宣ju,0,0,0,nan,nan,下一次发工资什么时候啊……不会还有二十来天吧！！！[单身狗],2018/6/9 22:16
126,5438368155,工资,2023/1/3 14:38,https://weibo.com/5438368155/MmDDkFydV?refer_flag=1001030103_,5438368155,4.85E+15,Sesshoumaru原子小金刚,0,0,0,nan,nan,我这么嘿累，天天没日没夜的干活，能不能给我一万工资（税后）,2014/12/20 16:59
442,3243994160,工资,2023/1/3 14:37,https://weibo.com/3243994160/MmDDfauqX?refer_flag=1001030103_,3243994160,4.85E+15,今天准点下班可以么,0,3,1,nan,nan,一日庸庸碌碌，无事可记……上任一把手一年的哥哥说借点钱，工资发不出去了，我婉拒，借钱发工资听上去很仗义，其实很麻烦。要帐的烦恼：我问大老总阳过了吗？大老总说明后天上班就给你解决，放心吧！我觉得还是放不下心，为什么明后天才上班？到底是明天还是后天？赊账一时，烦恼一年………隔壁新,2013/3/23 10:44
452,1480133234,工资,2023/1/3 14:32,https://weibo.com/1480133234/MmDBemWZO?refer_flag=1001030103_,1480133234,4.85E+15,欧美家具专家,0,0,0,nan,nan,什么时候发工资想花钱,2010/4/7 22:05
108,5641237840,工资,2023/1/3 14:32,https://weibo.com/5641237840/MmDB50cD1?refer_flag=1001030103_,5641237840,4.85E+15,QQ空间一级用户,0,1,0,nan,nan,救命算工资和发工资的心情是两个极端,2015/6/27 13:46
215,5389068863,工资,2023/1/3 14:28,https://weibo.com/5389068863/MmDzz012g?refer_flag=1001030103_,5389068863,4.85E+15,职教胜利,0,2,0,nan,nan,3号了还不发工资，要是没有阿雯我可怎么活啊,2014/11/26 13:22
15,3948637369,工资,2023/1/3 14:11,https://weibo.com/3948637369/MmDsJytsA?refer_flag=1001030103_,3948637369,4.85E+15,4xxxx春日,0,0,0,nan,nan,同事说我的工资应该都不够我吃我？就那点一千刚出头的工资够吃个屁甚至前几天还给我爸转了一千当家用同事说我工作了十几年都没给过家里一分家用我一脸[費解][費解][費解]可是我天天在家蹭吃蹭住的哈哈哈她说没让家里人扶贫已经很好了还交家用学到了可是我答应了每个月转一千[打臉],2013/12/19 9:49
1510,2064989793,工资,2023/1/3 14:11,https://weibo.com/2064989793/MmDslBdTf?refer_flag=1001030103_,2064989793,4.85E+15,碎碎浰_,0,2,0,nan,nan,还是买了戴森可是我好心疼我那点工资[单身狗][单身狗][单身狗],2011/4/3 20:25
828,5321743141,工资,2023/1/3 14:08,https://weibo.com/5321743141/MmDrs3fgv?refer_flag=1001030103_,5321743141,4.85E+15,bunananananaa,0,0,0,nan,nan,工资还没读研时候的生活费多[悲伤],2014/10/9 15:21
177,5706655403,工资,2023/1/3 14:06,https://weibo.com/5706655403/MmDqmFIAS?refer_flag=1001030103_,5706655403,4.85E+15,想穿越想飞天想变成造字的仓颉,0,0,0,全国近94%县城房价不过万元,全国近94%县城房价不过万元,今天两年的车贷刚好还完最后一期，下个月的工资感觉会突然多了不少[doge][猪头]。,2015/9/19 20:18
1272,1687220323,工资,2023/1/3 14:05,https://weibo.com/1687220323/MmDqcoEhA?refer_flag=1001030103_,1687220323,4.85E+15,michael8446,0,2,1,nan,nan,工作6年了吧，我才换了第三份工作第一份工作一年做50家店，那时候只是去过福建培训一次，就已经觉得自己牛了第二份工作一年做100家店，还全国跑着出差，到处打卡做项目，工资也翻来一倍不止，觉得更牛了现在我一个月30家店，还绰绰有余，年终了我都不敢数自己做了多少家，不觉得自己牛了，觉得自己,2010/1/28 23:07
147,2949787530,工资,2023/1/3 14:03,https://weibo.com/2949787530/MmDpr6UUa?refer_flag=1001030103_,2949787530,4.85E+15,Elinor别闹,0,1,6,nan,nan,有些人辛苦打工一年最后还拿不到工资你卖屁个惨那就祝你明年也过得不好啊[微笑],2012/8/14 8:22
1166,1221493904,工资,2023/1/3 13:53,https://weibo.com/1221493904/MmDlalbh3?refer_flag=1001030103_,1221493904,4.85E+15,欢乐宋懒精灵,0,2,0,nan,nan,"""人家配音老师辛辛苦苦录的“：哈哈哈，那啥，他们拿比你高很多的工资录出来的。倒不是说他们不辛苦，但凡工作有不辛苦的嘛。另：你们有觉得贴觉得神仙的自由，别人也有觉得是垃圾的自由",2011/5/21 16:35
320,5168288235,工资,2023/1/3 13:53,https://weibo.com/5168288235/MmDl2kgYH?refer_flag=1001030103_,5168288235,4.85E+15,ringo_no_sky,1,0,1,nan,nan,现在的工作让我很迷茫，这个工作离家远，累，消耗身体，没成果，难升职，工资低，不加薪，职称也得自己考，就趁假期长，还放的稀碎（不是抱怨），但是有个编制就很难决定辞职，其实做的很不开心，很纠结。,2014/6/3 21:30
55,3513421905,工资,2023/1/4 14:57,https://weibo.com/3513421905/MmNbK8cKl?refer_flag=1001030103_,3513421905,4.85E+15,Suyangpeng,0,0,6,nan,nan,公司昨天来了一个学广播电视的研三学生，工资转正5000，一时间情绪万千：第一、文科研究生真的不值钱，新闻这一块的更不值钱了……第二、上班了两天离职了，两个老板气死了，因为听说给她画了一天的饼，别人不吃……第三、老板说我们公司是艘大船，我想说沉沦的时候别拉我[污],2013/6/4 8:29
285,1649977010,工资,2023/1/4 14:52,https://weibo.com/1649977010/MmN9Mj79V?refer_flag=1001030103_,1649977010,4.85E+15,小周和,0,0,0,nan,nan,前东家一到年底就发很多钱，哈哈哈哈，很多人都问我，工资那么高，待遇那么好，为啥要辞职，可我想过的开心一点，就这么简单[笑cry],2009/11/30 13:17
134,6013393964,工资,2023/1/4 14:50,https://weibo.com/6013393964/MmN8SwyP7?refer_flag=1001030103_,6013393964,4.85E+15,什么芋泥脆脆弹弹,0,0,1,nan,nan,要自已的工资为什么叫讨薪？应该不是自已的钱才叫讨，这是谁第一个叫讨薪的，难道不应该…#农民工讨薪##快手#@快手http://t.cn/A6KFYJTz,2016/8/31 8:05
784,2548374210,工资,2023/1/4 14:42,https://weibo.com/2548374210/MmN5C980R?refer_flag=1001030103_,2548374210,4.85E+15,G家旺财,0,0,1,nan,nan,今天心情挺不错的，因为好多事情吧，重要的是发工资了，第一次学会了在系统里做奖励性绩效业务了。被领导喊去谈话，解开了我前阵子的一些烦恼，总之挺开心的。纵然晚上大消杀，累的腰疼，但还是开心的。我的宝贝也恢复健康了。慢慢好起来了。,2011/11/20 16:40
94,5583756045,工资,2023/1/4 14:42,https://weibo.com/5583756045/MmN5A1LcH?refer_flag=1001030103_,5583756045,4.85E+15,未来仍可期yuer,0,0,0,nan,nan,"晚上吃饭姐姐说到了工作问题上说还是我们这种幸福不操心没压力每个月按时工资到位她们一到年底各种惆怅工人要工资材料要结款钱又不好收愁的觉都睡不好哈哈哈我还羡慕她呢开豪车住豪宅我虽然没有她那么累那么操心可是我赚的钱也少啊[笑cry]反正人都是不满足的记得看过一段话：""巷子里",2015/4/9 13:47
1417,2384587544,工资,2023/1/4 14:41,https://weibo.com/2384587544/MmN5diG4f?refer_flag=1001030103_,2384587544,4.85E+15,Zebra呀_,0,2,3,nan,nan,这三千块钱的工资真的快把我命要了好累??,2011/9/9 19:03
46,6540739766,工资,2023/1/4 14:41,https://weibo.com/6540739766/MmN58vzTq?refer_flag=1001030103_,6540739766,4.85E+15,逃离Lc,0,0,0,nan,nan,我就不想奋斗，不想评职称，就想拿着这几千块钱工资干三十年后退休养老,2018/5/3 11:06
351,3063690327,工资,2023/1/4 14:32,https://weibo.com/3063690327/MmN1Fblby?refer_flag=1001030103_,3063690327,4.85E+15,朱朱_媛,0,0,1,nan,nan,想换份赚钱的工作了，工资六千，到手的，交五险一金，怎么才能换？,2012/10/25 13:01
2,5368733263,工资,2023/1/4 14:27,https://weibo.com/5368733263/MmMZGdCGj?refer_flag=1001030103_,5368733263,4.85E+15,酷酷小欧顺利毕业,0,0,0,nan,nan,最近追完了双宋的两部剧主题都是关于财阀复仇贫穷和霸凌的人与人之间的差距为何如此之大自己也教过有钱人家的孩子他们从幼儿园开始上的就是最顶尖的学费一年10万起步而这只不过是我们大部分普通人一年的工资,2014/11/12 16:13
287,3150806852,工资,2023/1/4 14:24,https://weibo.com/3150806852/MmMYjlSd8?refer_flag=1001030103_,3150806852,4.85E+15,崆山岚,0,0,0,nan,nan,今天在公司开会领导提了公司优化的事有时候真觉得公司太狗了优先优化孕妇，还取消孕妇早十晚四的福利裁员还不给n+1，给发前两个月没发的工资都还当作福利，就这还想让人感恩戴德呢[费解]真是不想讲了#优化##裁员#,2013/1/18 12:13
152,3157930122,工资,2023/1/4 14:20,https://weibo.com/3157930122/MmMWwl7Jv?refer_flag=1001030103_,3157930122,4.85E+15,斯人默尔锁,0,0,1,nan,nan,这世界有那么多人这世界有那么多人，当我们年轻的时候，我们工作，我们生活，我们积蓄。这样至少在年老的时候，可以赚一份退休工资。钱多的时候可以帮衬孩子，如果不多，也至少努力自给自足不让自己成为孩子的负担。有时候下班路上，总见到翻捡垃圾箱的别人家的父亲或母亲。他们是没有退休工资还是,2013/1/21 8:25
360,5513052171,工资,2023/1/4 14:17,https://weibo.com/5513052171/MmMVojfNO?refer_flag=1001030103_,5513052171,4.85E+15,凡尘水滴_70338,0,0,1,nan,nan,太累了。。太累了。。太累了今晚做的记录真的太累了。。。。。太多了。。。蕾克西班纳最好给我发工资[开学季][开学季],2015/2/8 18:06
22,5859669271,工资,2023/1/4 14:14,https://weibo.com/5859669271/MmMUcE01L?refer_flag=1001030103_,5859669271,4.85E+15,霹雳壮娃逗逗乃,0,0,0,nan,nan,很穷，但唯一解压的方式是花钱，工资拿到手就花光，所以更穷了。,2016/2/15 10:22
53,3607140920,工资,2023/1/4 14:13,https://weibo.com/3607140920/MmMTSj1Hw?refer_flag=1001030103_,3607140920,4.85E+15,纯粹理性饥饿,0,0,0,nan,nan,发现发了工资大家不是买电脑买手机就是去旅游[开学季][开学季][开学季],2013/7/20 14:16
835,2104134301,工资,2023/1/4 14:11,https://weibo.com/2104134301/MmMT5ufL3?refer_flag=1001030103_,2104134301,4.85E+15,小岛盈盈,0,1,0,nan,nan,不发工资还有脸提要求，谁给你这么大的脸cnm[怒骂],2011/4/24 12:05
183,5446204043,工资,2023/1/5 14:59,https://weibo.com/5446204043/MmWCQuFJL?refer_flag=1001030103_,5446204043,4.85E+15,兔子lx兔紫,0,0,0,"工作没有老板会快乐吗,工作使我快乐",工作没有老板会快乐吗工作使我快乐,八点驾车去医院早班。失望的。病房内各冲一杯牛奶开始输液。昨日美股新能源强势反弹今日开盘动手。全天强势。外资买入百亿+。治疗后买菜回家做火锅。午睡后取款支付小哥工资。昨天药品他已经收到。印度版辉瑞估计还有一周。午休晚餐。不再出门。倍感疲倦。晚妻抗原转阴。[耶]阶段性胜利！,2014/12/22 12:40
1945,2736362990,工资,2023/1/5 14:58,https://weibo.com/2736362990/MmWCHzpnm?refer_flag=1001030103_,2736362990,4.85E+15,绿茶微美,0,0,0,nan,nan,今天培训海南和云南的酒店产品然后我默默地计算了一下自己两个月的工资也住不了一晚啊有钱真好有钱人的钱都是怎么来了,2012/3/10 10:10
423,1926800074,工资,2023/1/5 14:58,https://weibo.com/1926800074/MmWCCAeed?refer_flag=1001030103_,1926800074,4.85E+15,Miuyaa-,0,0,0,nan,nan,连着高效两天都跟我妈视频，给人整习惯了，要找我唠嗑[二哈]我也希望早点回家，可是真不容易啊新年愿望就是早点实现早九晚六吧[揣手]真无语，想立个省钱的flag……一记账人麻了，12月社保基数一调，工资发了跟没发一样，花钱如流水……钱难挣但真好花啊[裂开],2011/1/26 15:03
311,5183502311,工资,2023/1/5 14:58,https://weibo.com/5183502311/MmWCzCTpP?refer_flag=1001030103_,5183502311,4.85E+15,新阶段来了心生一季,0,7,2,nan,nan,老板要跟我合伙开工作室哎，独立于原公司，可以不接我不想接的活儿的活儿，还可以接外面的活儿，不用坐班，还有固定工资——天上掉馅饼，事出反常必有妖[doge],2014/6/17 12:15
99,5384923067,工资,2023/1/5 14:55,https://weibo.com/5384923067/MmWByr4OZ?refer_flag=1001030103_,5384923067,4.85E+15,好运朱古力,0,0,0,"心情,职场",心情职场,希望老板想让员工加班的时候，主动提你能给多少??吧，不然就那点工资，没有动力大过年的给你加班,2014/11/23 17:51
87,5831271477,工资,2023/1/5 14:51,https://weibo.com/5831271477/MmWzDBw59?refer_flag=1001030103_,5831271477,4.85E+15,嘉舒的日记,0,0,0,深夜树洞,深夜树洞,刚发的工资还的所剩无几,2016/1/17 10:48
0,1838615154,工资,2023/1/5 14:49,https://weibo.com/1838615154/MmWz8B2Jx?refer_flag=1001030103_,1838615154,4.85E+15,Jovry__,0,0,0,nan,nan,一个月工资过一年,2010/10/2 10:27
231,6340866978,工资,2023/1/5 14:42,https://weibo.com/6340866978/MmWw923ZJ?refer_flag=1001030103_,6340866978,4.85E+15,拾彡_月,0,0,3,nan,nan,以为今天会发工资和绩效呢，等一天了，一根毛都没发[苦涩],2017/8/8 11:25
100,3319489811,工资,2023/1/5 14:40,https://weibo.com/3319489811/MmWvryulg?refer_flag=1001030103_,3319489811,4.85E+15,何禾每天要快乐,0,0,0,nan,nan,碎碎念：虽然会有很多不开心的小插曲但也会被很多人温暖和感动到作为卑微实习生工资低的可怜结果还因为??了请了一个星期的假，不仅扣了全勤奖还要扣掉一星期工资，使本就贫困的我雪上加霜[伤心]但是我的老板真的很好，他给我补了一星期的工资，说小孩子在外面不容易[太阳]真的会被感动死[泪],2013/4/30 21:27
175,2949339544,工资,2023/1/5 14:38,https://weibo.com/2949339544/MmWuprcu2?refer_flag=1001030103_,2949339544,4.85E+15,潘_sky,0,0,1,打工人年底发疯图鉴,打工人年底发疯图鉴,从小到大的梦想，就是有一间属于自己的房子。不知道这个梦想这辈子会不会实现？！每次看手机，别人发的装修房子的视频、上班路上都会幻想！这是我一直缺的安全感。但是工资微乎其微，有时候看手机别人做“小三”能赚很多钱，我这脑子和长相，估计都没人能看上[允悲]。,2012/8/13 19:48
4885,5994401927,工资,2023/1/5 14:35,https://weibo.com/5994401927/MmWt6r7Js?refer_flag=1001030103_,5994401927,4.85E+15,苏打要发财了,0,0,4,nan,nan,主任家儿子都俩月多了，后个要办满月酒，我要是一天有四节课的话，我一天的工资还不够随个礼了[泪]打工人好难啊[泪]这疫情期间，工作也快半年了，但收支几乎相抵，打工人攒钱好难啊[泪],2016/8/1 8:13
355,5116845355,工资,2023/1/5 14:34,https://weibo.com/5116845355/MmWsO81Mw?refer_flag=1001030103_,5116845355,4.85E+15,高可人儿,0,2,0,nan,nan,突然找到了一千一百块钱真开心！！！比收到工资还开心哈哈哈哈哈哈哈哈哈哈,2014/4/19 9:17
536,2162535111,工资,2023/1/6 14:54,https://weibo.com/2162535111/Mn61ygyTM?refer_flag=1001030103_,2162535111,4.86E+15,Tiffany_尼尼萌,0,4,2,nan,nan,晚上大致算了一下，工资（扣除五险一金一费一税实际到手部分）、年终奖、市委办文件校对费、单项工作劳务费、书刊校对费等年前至少可以收到2万元。不过对我来说，这点钱还是太少了，几年前，光年终奖一项我就可以拿到2万多元，后来缩水一半多。,2011/6/4 22:13
58,5311932319,工资,2023/1/6 14:46,https://weibo.com/5311932319/Mn5Yl2wDQ?refer_flag=1001030103_,5311932319,4.86E+15,是霞仔啊,0,0,0,nan,nan,爸爸说你有欠钱吗？我刚发了工资给你两万，我那时候刚好在一个人哭、因为很多的感悟在流眼泪。可是听到爸爸这样的声音，我想哭的更猛烈，但是我没有，如果是小时候我肯定会大声哭不会害怕他担心只会宣泄自己的感情，但是现在不能，因为不能让他担心，不能在他累的时候还让他担心我是不是出什么事了。,2014/9/27 14:25
318,5100894547,工资,2023/1/6 14:43,https://weibo.com/5100894547/Mn5WZFpWr?refer_flag=1001030103_,5100894547,4.86E+15,-黑椒尘埃-,0,0,0,nan,nan,公司再走下坡路工资还有很多还有没开，两千来块钱还没有报销，还得再找工作！原本在一起工作聊的一起来的同事，也相继不在项目上了离开了这个公司。现在已经失去了努力的动力，已经失去了曾经的欢声笑语，剩下的只有对公司的失望和对离开这里的同事们恋恋不舍。,2014/4/30 20:43
530,5455466404,工资,2023/1/6 14:34,https://weibo.com/5455466404/Mn5TrkS4r?refer_flag=1001030103_,5455466404,4.86E+15,KstrangetHL,0,8,1,nan,nan,工资都被我吃完了[泪],2015/1/1 15:40
766,5256831932,工资,2023/1/6 14:33,https://weibo.com/5256831932/Mn5SSEQ3Y?refer_flag=1001030103_,5256831932,4.86E+15,小小仙果子,0,0,0,"顾南亭年薪,王凯向风而行",顾南亭年薪王凯向风而行,每天都想着怎么做拿同样的工资做最轻松活,2014/10/16 20:03
98,3178858247,工资,2023/1/6 14:31,https://weibo.com/3178858247/Mn5S2aJGW?refer_flag=1001030103_,3178858247,4.86E+15,脾气不太郝女士_,0,1,0,nan,nan,这个月涨了工资又中了两瓶茅台但是觉得心脏不舒服今天又拉肚子现在生活美滋滋身体一定要挺住[泪],2014/3/6 0:17
171,3172566451,工资,2023/1/7 14:54,https://weibo.com/3172566451/MnfrV7LRR?refer_flag=1001030103_,3172566451,4.86E+15,漫漫远兮兮兮,0,0,0,nan,nan,其实我以前也会有很多想法的我本来也没打算留在家里但是有一天我看到一个视频想起我奶奶年纪越来越大的我爸爸妈妈身体也不是很好想了好久还是留在家里吧。我不想我奶奶以后想我了连视频一下都不行家里工资待遇真的很低的我爸想让我去武汉，他说问问我xxx那边是什么情况，还帮我问了苏州那边，,2012/12/5 21:17
72,3224734773,工资,2023/1/7 14:46,https://weibo.com/3224734773/MnfoUAWKx?refer_flag=1001030103_,3224734773,4.86E+15,请不要说我有双下巴,0,0,0,nan,nan,妈呀今天胡说八道了一通结果弟弟认真了把奖励给他的奖金给我了我说实在不行我给你v50一人一半他说你收下吧就当作这几天陪我玩监督我写作业的工资再也不说他是没素质的直男了[泪],2013/1/14 18:24
59,3416208670,工资,2023/1/7 14:41,https://weibo.com/3416208670/MnfmCanig?refer_flag=1001030103_,3416208670,4.86E+15,伽斐熊,0,15,69,沈月入行第一部戏的片酬被偷,沈月入行第一部戏的片酬被偷,无语请个假还要问东问西的搞得像我说明理由不扣我工资一样[汗]有事就有事你管我什么事…,2013/5/4 23:03
114,6348665113,工资,2023/1/7 14:37,https://weibo.com/6348665113/Mnfl5F8qA?refer_flag=1001030103_,6348665113,4.86E+15,凌修修,0,0,0,nan,nan,你最好是给了落落双倍工资让跑这么多行程[微笑],2017/8/25 15:49
7,3911078926,工资,2023/1/7 14:34,https://weibo.com/3911078926/MnfjSi4iO?refer_flag=1001030103_,3911078926,4.86E+15,秋秋和秋秋嗳,0,0,0,nan,nan,今天给我做美甲的姐姐，曾经是一名幼师。她说她是一名教了八年幼儿园的班主任，并且在幼儿园给编制的时候考上了编，多么完美，多么令人羡慕，可是她辞职了…我非常的不理解，可是我转念一想，没有什么不理解的，她做美甲一个月上万，而有编制幼儿园老师也只是四五千的死工资，或许她的选择是正确的…,2013/11/19 19:40
296,2694076410,工资,2023/1/7 14:20,https://weibo.com/2694076410/Mnfe3bxQm?refer_flag=1001030103_,2694076410,4.86E+15,处女座美少女,0,0,0,nan,nan,快点发工资！我要领养一只鼠鼠！！,2012/1/30 14:12
620,1725632472,工资,2023/1/8 14:57,https://weibo.com/1725632472/MnoTCFSjI?refer_flag=1001030103_,1725632472,4.86E+15,Vi幸运草,0,5,0,nan,nan,认真算了算2022年工作了不到五个月也就是一年中，有一半的时间我都没有工作但是好像浑浑噩噩地过了这一年这一年，虽然工资很高，但是我却没什么钱这一年，虽然我时间很多，但是我却哪里都没有去这一年我想通的事情有很多，等待去实现的事情就更多了明明我拥有了想要很久的gapyear啊但是我却什,2010/4/5 22:42
