293,3431279810,工资,2023/3/6 14:52,https://weibo.com/3431279810/Mw4e9jGox?refer_flag=1001030103_,3431279810,4.88E+15,TEUB_七瑾,0,0,1,nan,nan,[单身狗]焦虑everyday还好买的营养餐都在路上了[单身狗]发工资后再囤点苦了我不能苦孩子@水水水水母谢谢ee拍的照片,2013/5/7 20:12
305,2878242621,工资,2023/3/6 14:51,https://weibo.com/2878242621/Mw4dC1UTK?refer_flag=1001030103_,2878242621,4.88E+15,米筱兔Q,0,0,0,nan,nan,什么时候我的工资恢复到之前的七八千?我相信很快了。[微笑][微笑][坚强］,2012/9/28 20:50
410,2126993451,工资,2023/3/6 14:46,https://weibo.com/2126993451/Mw4bnDM9L?refer_flag=1001030103_,2126993451,4.88E+15,凉梨梨梨,0,4,0,nan,nan,虽然工作很幸苦，但是工资到手的那一刻真的能笑出花来[泪],2011/5/10 12:04
19,5579376707,工资,2023/3/6 14:42,https://weibo.com/5579376707/Mw4a21uER?refer_flag=1001030103_,5579376707,4.88E+15,方块short酥,0,0,0,nan,nan,#每天摸鱼打卡##花式摸鱼现场#还有9天发工资,2015/4/3 19:50
676,2739521361,工资,2023/3/6 14:42,https://weibo.com/2739521361/Mw49X4vBo?refer_flag=1001030103_,2739521361,4.88E+15,终于听见下雨的声音了鸭,0,0,0,"每天摸鱼打卡,花式摸鱼现场",每天摸鱼打卡花式摸鱼现场,今晚儿子试听一堂口才课，被老师的声音和颜值给吸引过来的。感觉确实挺不错的。跟同学的妈妈聊聊天，发现都是美吉姆的学员，蒙氏教育的理念。周一忙了啥？收发文件，发工资，发培训通知，审核招聘方案等，看上去忙来忙去，但为何有这种空洞感？,2014/3/11 5:14
248,1251695930,工资,2023/3/6 14:41,https://weibo.com/1251695930/Mw49EqipO?refer_flag=1001030103_,1251695930,4.88E+15,静安蓝乔,0,0,2,nan,nan,这么上班，20号发工资1300都没有就真的很好笑了,2010/7/23 7:46
119,2303103391,工资,2023/3/6 14:40,https://weibo.com/2303103391/Mw48X1lCD?refer_flag=1001030103_,2303103391,4.88E+15,一缕阳光XDF,0,0,1,nan,nan,一顿操作猛如虎一看工资2500??,2011/8/14 16:52
895,1770073165,工资,2023/3/6 14:39,https://weibo.com/1770073165/Mw48QabCT?refer_flag=1001030103_,1770073165,4.88E+15,豹子女士大漂亮,0,2,0,nan,nan,新公司入职的时候老板说就当自己创业……然后今天副总对我说，我的业绩利润要能负担副总工资+采购工资+运营工资，如还有超出部分，团队和老板五五分……其他公司我这个岗位算是后勤岗……到这个公司……我感觉不跑几个大客户可能后期就要负担不起这么多人工资了……如果是自己创业，那我想问能把副总开,2010/7/7 20:20
387,1930601097,工资,2023/3/6 14:39,https://weibo.com/1930601097/Mw48PgVXJ?refer_flag=1001030103_,1930601097,4.88E+15,流浪的蜜儿,0,0,0,nan,nan,你要知道五险一金和刚工作几千块的工资以及合适的工作环境是很基本的要求，如果社会达不到，那是社会有问题，而不是员工有问题。也就是说，如果大家都卷，有人躺平，你可以说ta不努力，但是不代表ta是错的,2011/1/22 11:24
367,3592178483,工资,2023/3/6 14:39,https://weibo.com/3592178483/Mw48Icyji?refer_flag=1001030103_,3592178483,4.88E+15,来一盘咸蛋茄子,0,0,5,nan,nan,我们是何其有幸健康，无忧的来到这个世界上。重看一集人间世内心：发不发工资的活着就很好了。过了两秒工资还是要发的呀[泪],2013/7/30 10:13
204,3931313088,工资,2023/3/6 14:39,https://weibo.com/3931313088/Mw48CACyc?refer_flag=1001030103_,3931313088,4.88E+15,Alex呀呀,0,0,0,nan,nan,"其实一个人财富的多少是由于他的社会价值体现的你能给多少人开工资你能创造多少就业决定一个老板的腰包#企业家是社会财富创造的发动机##财富自由,追梦更自由##通往财富自由之路##人生所求是争做创造社会价值的主角##财富是认知的变现#",2013/12/7 8:48
167,1862703191,工资,2023/3/6 14:35,https://weibo.com/1862703191/Mw4709SYK?refer_flag=1001030103_,1862703191,4.88E+15,麻将九,0,0,2,nan,nan,还没有约束手段，信你才有鬼，工资就是最直接的约束手段，这还用直说吗[笑cry][笑cry][笑cry][笑cry][笑cry],2010/11/14 20:53
1088,1799181295,工资,2023/3/6 14:32,https://weibo.com/1799181295/Mw45XnH7D?refer_flag=1001030103_,1799181295,4.88E+15,展晴pzq,0,0,0,nan,nan,?你的资产管理，考虑过“三权”维度吗？比如你的工资卡上交给夫人，所有权、控制权、使用权都在你手里嚒？[太阳]#资产管理#,2010/8/20 22:16
668,1863131273,工资,2023/3/6 14:32,https://weibo.com/1863131273/Mw45OwRGP?refer_flag=1001030103_,1863131273,4.88E+15,明亚保险经纪邓娴蕾,0,1,0,资产管理,资产管理,#两会我想说#大一大二的大学生找实习，招人单位：实习时间至少三个月。但是，大一大二根本没这么长时间用来实习。[苦涩]教师的工资可以提高点吗，或者说可以让老师只教书吗？独生女的父母（没有稳定收入的）可以给予补助吗？,2010/11/15 13:39
94,5990646128,工资,2023/3/6 14:32,https://weibo.com/5990646128/Mw45ErSYv?refer_flag=1001030103_,5990646128,4.88E+15,Maytau·,0,0,0,nan,nan,体制内领导敦促我加班，劝诫我努力，说话之前你tm动脑子了吗想让我加班多干活是不是得给我好处？反正工资就那一份，还不让人摆烂了？我tm要是想好好努力我还考公务员吗？？？过年到现在加了多少班了有点b数吧，天天给你做无用功没跳起来打你给你脸了已经,2016/7/24 10:42
251,6085444618,工资,2023/3/6 14:31,https://weibo.com/6085444618/Mw45zrBw1?refer_flag=1001030103_,6085444618,4.88E+15,林顿的芽芽酱,0,1,1,nan,nan,这个星期完全没有想要上班的心情，今天坐在办公室里每一分每一秒都是煎熬！只能不停催眠自己要忍住，周三下午不上班，周五发工资，忍一忍海阔天空！,2016/12/11 16:25
88,5646274726,工资,2023/3/6 14:31,https://weibo.com/5646274726/Mw45nmWxJ?refer_flag=1001030103_,5646274726,4.88E+15,变成星星飞走啦,0,0,0,nan,nan,我的钱怎么越来越少tm工资是没攒一分啊[怒][怒][怒][怒],2015/7/5 14:16
163,5624986818,工资,2023/3/6 14:27,https://weibo.com/5624986818/Mw43N0h4r?refer_flag=1001030103_,5624986818,4.88E+15,清河甜味儿,0,0,0,nan,nan,没有刻意减肥就是单纯吃不好，睡不好心情不好课时不断加满工资不断缩水,2015/6/5 13:58
24,2591654987,工资,2023/3/6 14:24,https://weibo.com/2591654987/Mw42yoO1h?refer_flag=1001030103_,2591654987,4.88E+15,苏芳的桔子,0,0,0,nan,nan,什么时候发工资啊??,2012/2/10 22:01
252,5345006863,工资,2023/3/6 14:20,https://weibo.com/5345006863/Mw412bpOU?refer_flag=1001030103_,5345006863,4.88E+15,格子间的青涩流年,0,0,1,nan,nan,这月假过得是真的快唯一能支撑我的只有那每个月中旬的工资了,2014/10/28 11:37
50,5915325576,工资,2023/3/6 14:18,https://weibo.com/5915325576/Mw40heCF6?refer_flag=1001030103_,5915325576,4.88E+15,1979朱令,0,0,0,nan,nan,几千的工资就别操那上万的心了散了散了,2016/5/2 20:25
33,5700309499,工资,2023/3/6 14:18,https://weibo.com/5700309499/Mw400Cfuh?refer_flag=1001030103_,5700309499,4.88E+15,whatIlL,0,0,1,nan,nan,#建议允许企业弹性安排法定节假日#对于打工人来说，节假日可以不考虑，随着疫情结束，各个行业都出现物价上涨的情况，是否企业可以给加一下工资待遇呢？这点为什么没有人提出呢？,2015/9/10 20:50
106,5702148843,工资,2023/3/6 14:13,https://weibo.com/5702148843/Mw3Y3eUEw?refer_flag=1001030103_,5702148843,4.88E+15,耳东_老陈,0,12,0,nan,nan,每日一省我怎么每天都在逛淘宝都想买衣服！！！能不能有点自制力没有办法早起去学校做早操不知道我的工资够不够我扣[苦涩]总结我真是一个平平无奇的花钱小能手呢,2015/9/12 15:21
201,3872957567,工资,2023/3/6 14:12,https://weibo.com/3872957567/Mw3XysJEU?refer_flag=1001030103_,3872957567,4.88E+15,cherryuf,0,0,0,nan,nan,买了衣服都是喜欢的希望买回来好看多久发工资啊生气生气,2013/10/26 15:46
108,6602173783,工资,2023/3/6 14:10,https://weibo.com/6602173783/Mw3X6pzkA?refer_flag=1001030103_,6602173783,4.88E+15,很肖张的泰勒公式,0,0,7,代表称要警惕考研高考化趋势,代表称要警惕考研高考化趋势,为什么请假明明都不要他的工资了我还这么卑微[苦涩][苦涩],2018/7/16 16:00
240,5327355235,工资,2023/3/6 14:08,https://weibo.com/5327355235/Mw3W926Gz?refer_flag=1001030103_,5327355235,4.88E+15,熬夜变成江流儿-,0,0,0,nan,nan,好消息是玩刮刮乐中了20坏消息是工资只发了2.1-2.25的2月剩下几天的工资4月才发好消息是今天的工作完成的还不错坏消息是加班到了现在,2014/10/12 13:42
213,5416445404,工资,2023/3/6 14:08,https://weibo.com/5416445404/Mw3W7xeOz?refer_flag=1001030103_,5416445404,4.88E+15,面包夹烤棉花糖,0,2,0,nan,nan,工作的本质是卖时间，你要做到卖一份时间赚两份收入，一份收入是工资，另一份收入是成长。,2014/12/14 15:17
124,5564744217,工资,2023/3/6 14:07,https://weibo.com/5564744217/Mw3Vykbb2?refer_flag=1001030103_,5564744217,4.88E+15,是个美腻的富婆,0,4,0,nan,nan,同事：田田！发工资了！我：我知道看到啦同事：哦哦那就行，我怕你没注意到我：怎么可能！！我这个财迷，晚半个小时我都要骂人的????,2015/3/20 15:59
178,6415057217,工资,2023/3/6 14:06,https://weibo.com/6415057217/Mw3VirbJb?refer_flag=1001030103_,6415057217,4.88E+15,超级自恋的小仙女,0,0,1,nan,nan,#建议允许企业弹性安排法定节假日#难道现在不是弹性安排吗？你直接建议没有就得了吧！我工作12年来可一直都是排班制休的，从来都是该上班上班的。万恶的资本家、你直接建议取消3倍工资吧。,2017/11/21 20:37
71,5387233312,工资,2023/3/6 14:04,https://weibo.com/5387233312/Mw3UlBNC0?refer_flag=1001030103_,5387233312,4.88E+15,微无拘无束,0,0,0,nan,nan,目前的工作状态是依萍的下班时间可云的精神状态李副官的拉车工资还要吃着陆振华的精神大饼忍受着雪姨的上级脾气更要时刻保持杜飞的心态。,2014/11/25 15:31
10,1760349827,工资,2023/3/7 14:56,https://weibo.com/1760349827/MwdGftUoT?refer_flag=1001030103_,1760349827,4.88E+15,闲情呷茶司令部,0,0,0,nan,nan,Day967公司招了我就得让他们知道我是很贵的交接别人的工作为什么不把他工资分我点呢,2010/6/20 21:09
184,5202189849,工资,2023/3/7 14:55,https://weibo.com/5202189849/MwdFBiMr3?refer_flag=1001030103_,5202189849,4.88E+15,啾咪几米,0,0,0,nan,nan,冬天跟春天永远是最忙的今天过去感觉昨天烦恼的都解决了希望后续给点力吧也期待发工资明天妇女节公司会给什么呢今天拿到了个玻璃杯感觉很棒[打call],2014/7/2 13:17
303,3150969544,工资,2023/3/7 14:48,https://weibo.com/3150969544/MwdCKhHta?refer_flag=1001030103_,3150969544,4.88E+15,碎碎念check,0,0,0,nan,nan,开心！工资大概能涨一点啦！！！,2013/2/1 20:42
368,1928186724,工资,2023/3/7 14:41,https://weibo.com/1928186724/MwdzTydT9?refer_flag=1001030103_,1928186724,4.88E+15,Vic_TorIazz,0,0,0,nan,nan,没发工资寸步难行[微笑],2011/1/28 21:27
174,5255610144,工资,2023/3/7 14:38,https://weibo.com/5255610144/MwdyDkqet?refer_flag=1001030103_,5255610144,4.88E+15,areyouwxx,0,0,1,nan,nan,买了！！！兜里空空！！！坐等下个月发工资了！！！等待和老婆一起开箱！！！[春游家族],2014/8/18 21:33
123,5692937243,工资,2023/3/7 14:37,https://weibo.com/5692937243/MwdyfjUkY?refer_flag=1001030103_,5692937243,4.88E+15,无语xx子,0,4,1,nan,nan,每天都很忙。昨天早上游泳，下午收拾家，接着打开电脑写游记，晚上瑜伽后接着写。很辛苦。今天早上去移动办宽带停机，又去看娃，下午去苏宁看电器，又去人人乐买日用品，晚上瑜伽。现在锻炼身体最重要，健康放在第一位，所以只要有时间，早上就去游泳晚上做瑜伽。现在的家电都太贵了，也是没有不贵的,2015/9/3 0:20
339,2669266461,工资,2023/3/7 14:36,https://weibo.com/2669266461/Mwdy6fQVP?refer_flag=1001030103_,2669266461,4.88E+15,温驯的狮子座,0,0,0,nan,nan,这工作真的是工资低又累,2012/3/17 21:10
436,3298247792,工资,2023/3/7 14:36,https://weibo.com/3298247792/MwdxYtfwf?refer_flag=1001030103_,3298247792,4.88E+15,颖婳,0,0,0,nan,nan,今天一整天都很开心呀。早晨刚到食堂，就得知明天下午放假半天。[鼓掌]好像从来没有过呀。午饭前，又收到了工资。啊，我的工资终于不是3开头，是4开头了。[哈哈]午饭后，和同事散步，看到了美丽的樱桃花。还以惊人的速度买了9件衣服。[允悲]一开始挑了一件西装，一件打底衫，一条牛仔裤。准备付钱时，,2013/5/2 19:09
1092,1270464573,工资,2023/3/7 14:36,https://weibo.com/1270464573/MwdxTrRnH?refer_flag=1001030103_,1270464573,4.88E+15,轩小窗,0,9,5,nan,nan,女神经与女汉子的约会一天花掉一月工资[偷笑][偷笑][偷笑],2010/7/17 23:12
177,6110027366,工资,2023/3/7 14:32,https://weibo.com/6110027366/Mwdwjp0hJ?refer_flag=1001030103_,6110027366,4.88E+15,Boo粒,0,0,1,nan,nan,明天工资再不到账我就要闹了[单身狗],2017/1/22 16:48
291,5385349105,工资,2023/3/7 14:27,https://weibo.com/5385349105/MwdunF5SA?refer_flag=1001030103_,5385349105,4.88E+15,Awe桃果,0,0,0,nan,nan,别人在pyq感谢妈妈是世界上唯一能解百毒的良药我妈酸我工资低,2014/11/24 23:39
61,6367146018,工资,2023/3/7 14:25,https://weibo.com/6367146018/MwdtteXSn?refer_flag=1001030103_,6367146018,4.88E+15,明月在y彩云归,0,0,0,nan,nan,好爱我妈她说这个月开始到暑假工资不拿去标会全部存着给我暑假买金镯子,2017/9/13 14:20
1,6399175828,工资,2023/3/7 14:24,https://weibo.com/6399175828/MwdtdDypR?refer_flag=1001030103_,6399175828,4.88E+15,今年吞提万明年吞提兔,0,1,0,nan,nan,发工资就买鼠标[泪],2017/10/30 9:50
334,5714285628,工资,2023/3/7 14:21,https://weibo.com/5714285628/MwdrKBKkD?refer_flag=1001030103_,5714285628,4.88E+15,柠檬二爷,0,0,0,nan,nan,想买个ipad各平台价格比较了好几天纠结来纠结去还没决定买哪个妈的还不是因为穷这一个月破工资只够买两个低配的[苦涩],2015/9/30 20:29
70,5510793221,工资,2023/3/7 14:20,https://weibo.com/5510793221/MwdrEpwE8?refer_flag=1001030103_,5510793221,4.88E+15,爱吃鸭头的绝世靓妹,0,0,0,nan,nan,我找了一个工资很低但可能有点好玩的工作我爸：你现在的年纪就是一个追梦的年纪，给你以后的理想打基础吧啦吧啦“我的理想是嫁给富豪”我爸：跟你没话说，睡觉去吧,2015/2/6 8:07
108,6719787099,工资,2023/3/7 14:16,https://weibo.com/6719787099/Mwdq0pwIQ?refer_flag=1001030103_,6719787099,4.88E+15,早八的早上好到底是谁在好,0,2,2,nan,nan,明天周三，后天周四，大后天下午4点可以看黑暗荣耀，也是发工资的日子，一切都指望着周五了,2018/9/23 15:38
80,1685047997,工资,2023/3/7 14:08,https://weibo.com/1685047997/MwdmNCZbf?refer_flag=1001030103_,1685047997,4.88E+15,画图仔变画图佬,0,3,0,nan,nan,工资1800每天笑哈哈[嘘],2010/1/21 22:58
543,2500840232,工资,2023/3/7 14:07,https://weibo.com/2500840232/Mwdmb8Rst?refer_flag=1001030103_,2500840232,4.88E+15,快乐星球小福星-,0,0,0,nan,nan,通过今晚的亲身体验，我发现抑郁情绪的产生极有可能是：因为工资减少，单位提供的工作生活条件变差进而导致对未来没有期望。如果现状继续恶化，极有可能产生“还不如不活了”的推论，这是相当危险的。如何缓解抑郁情绪呢？单位通过三番五次画饼不给饼已经失去信用了，改善条件更是想屁吃。难怪这么多人,2011/10/29 9:49
1391,2384860230,工资,2023/3/8 14:59,https://weibo.com/2384860230/Mwn7Xm2pk?refer_flag=1001030103_,2384860230,4.88E+15,笨蛋車掌,0,0,3,nan,nan,无数个“下个礼拜发工资”的饼都干到吃不下去……,2011/9/9 21:34
130,5773697373,工资,2023/3/8 14:57,https://weibo.com/5773697373/Mwn6OucC1?refer_flag=1001030103_,5773697373,4.88E+15,Akkzxllw,0,0,0,nan,nan,光明网什么时候给我发工资,2015/11/28 10:20
403,3217759201,工资,2023/3/8 14:55,https://weibo.com/3217759201/Mwn6gcBeF?refer_flag=1001030103_,3217759201,4.88E+15,老公拿毛巾,0,0,0,nan,nan,omg救命看到一个211本科专业是旅游管理下的一个分支工资两千多??????看到我未来了哈哈哈哈,2013/1/10 21:42
302,3857047304,工资,2023/3/8 14:50,https://weibo.com/3857047304/Mwn4khHVF?refer_flag=1001030103_,3857047304,4.88E+15,寂琲,0,0,0,nan,nan,"#青你选手徐炳超卖包子#哇看到他们说要做体面工作就想到了上周和我爸吵架因为我爸嫌弃我工资低我说我去摆摊他却不同意因为他的框架里始终是你一个211出来的大学生怎么干这种事[跪了][跪了][跪了]""体面""一直是你们想追求的啊。。。",2013/10/17 14:46
174,5513968191,工资,2023/3/8 14:50,https://weibo.com/5513968191/Mwn4ffdUj?refer_flag=1001030103_,5513968191,4.88E+15,外婆的姥姥,0,1,7,青你选手徐炳超卖包子,青你选手徐炳超卖包子,只有我还在等待一月份的工资[晕]，目前看今天没戏，服了[摊手]，越拖越久，烦死了！！！,2015/2/8 10:39
915,6196954278,工资,2023/3/8 14:47,https://weibo.com/6196954278/Mwn34wvEU?refer_flag=1001030103_,6196954278,4.88E+15,灵璧清风,0,0,0,"女职工享有哪些特殊权益,女职工权益保护得到有效落实,妇女节",女职工享有哪些特殊权益女职工权益保护得到有效落实妇女节,#实习律师[超话]#郑州有高于2000工资的实习律师?,2017/4/6 16:22
266,2746055693,工资,2023/3/8 14:47,https://weibo.com/2746055693/Mwn2ZrQKH?refer_flag=1001030103_,2746055693,4.88E+15,虚空少年_YoYo,0,2,2,上海日记,上海日记,昂，是有些值得纪念的一天了??（图文无关）1?五点多被震感晃醒之后再也没能睡着，失眠绝望到天亮，广东咋回事哦最近老震??2?昨晚看到还不错的房，冲动和理智打架，不过今天还是果断签约了，顺利结束第二次找房，解决了一大焦虑我的脸别再爆痘了好吗！到广州不到两年我就要住进第三个房子了,2012/5/2 17:19
305,1792996102,工资,2023/3/8 14:46,https://weibo.com/1792996102/Mwn2zrDwj?refer_flag=1001030103_,1792996102,4.88E+15,开一朵坚韧的花,0,1,2,nan,nan,viper3难过就多看看工资卡[傷心][太陽],2010/8/15 0:26
1283,1786915521,工资,2023/3/8 14:41,https://weibo.com/1786915521/Mwn0E55uG?refer_flag=1001030103_,1786915521,4.88E+15,Its1derZara,0,6,6,nan,nan,我妈让我给我弟买水乳我:没钱我妈:你用花呗，完了给你我:不管，以前买的你都没给我，我上次发工资在一月十号你怎么不说我妈:不买了算了我妈然后自己在淘宝琢磨我妈:这个怎么入会我:不管我妈:你到底过来看不看我:不管我妈:不管了算了，离了你不能活，以后断绝关系，成了个屁了呵??,2010/8/4 16:28
73,5963678815,工资,2023/3/8 14:38,https://weibo.com/5963678815/MwmZ5aRxg?refer_flag=1001030103_,5963678815,4.88E+15,莓甜睐巅开心呀,0,10,8,nan,nan,公证律师真贵啊……384给我介绍的这个还是当时他找了很久的很便宜的公证律师……但是人家半个小时赚的钱（现金）顶我工作四个小时税后能拿到手的工资[允悲][允悲][允悲],2016/6/20 10:38
205,3115059763,工资,2023/3/8 14:37,https://weibo.com/3115059763/MwmYKtDZ7?refer_flag=1001030103_,3115059763,4.88E+15,但著胭脂匀注,0,0,0,nan,nan,给我妈发了红包，明明我这个月没钱了，给公司垫了3500，预留的生活费不够了，想从定期里取点，又觉得这样不好，这个月还剩200多，还好马上发工资[二哈],2012/11/28 11:24
329,5481373303,工资,2023/3/8 14:25,https://weibo.com/5481373303/MwmU4mCZX?refer_flag=1001030103_,5481373303,4.88E+15,河南建业贴吧公众号,0,0,0,超六成低龄老人想再就业,超六成低龄老人想再就业,大姨妈来了姐真的腰痛肚子痛求累吗上班了最好搞个姨妈假不要工资都行特么的,2015/1/16 22:34
1043,6444537222,工资,2023/3/8 14:18,https://weibo.com/6444537222/MwmR0mxS4?refer_flag=1001030103_,6444537222,4.88E+15,梅灵宫煞,0,0,0,nan,nan,怎么还不到10号发工资发工资发工资[挤眼],2017/12/26 12:54
233,2686158273,工资,2023/3/8 14:13,https://weibo.com/2686158273/MwmPhmfkW?refer_flag=1001030103_,2686158273,4.88E+15,En-vano,0,2,2,nan,nan,女生节的一个好消息：涨工资了坏消息是：加班了，并且明天还要跟某人逼逼逼[二哈],2012/3/29 12:19
298,5037815352,工资,2023/3/8 14:13,https://weibo.com/5037815352/MwmP2zGOf?refer_flag=1001030103_,5037815352,4.88E+15,-稚柚稚-,0,1,0,nan,nan,感觉到他对我的爱是有所保留的，他一直很会算账，觉得自己不能亏。他的工资是我三倍多，不知道他为什么这么会计较。今天是女神节，他啥也没有给我，只有一句祝福和悄无声息回家坐在沙发上给我吓得、让我知道什么叫魂飞魄丧。我不知道为什么我要跟他在一起，只因为怕自己没人要吗？是这样吗,2014/2/14 10:38
40,5973003313,工资,2023/3/8 14:10,https://weibo.com/5973003313/MwmNUdZDp?refer_flag=1001030103_,5973003313,4.88E+15,Hester乄,0,0,0,nan,nan,今天比发工资更快乐的就是葛Sir给亲属卡们提额[太开心],2016/6/30 9:44
184,5835736052,工资,2023/3/8 14:08,https://weibo.com/5835736052/MwmN0rrqY?refer_flag=1001030103_,5835736052,4.88E+15,香槟瓶子里肯定有问题,0,0,0,nan,nan,想哭，这不就是我吗？写到了心里，曾经的我在央企，工资福利稳定，还不错！现在的我在私企，工资不提，基本没啥福利，纯纯手工业工作者！白天忙忙碌碌，晚上回家倒头就睡，身体累，是真的，但，心，轻松了！,2016/1/22 15:04
2086,6029331675,工资,2023/3/8 14:05,https://weibo.com/6029331675/MwmLS94yp?refer_flag=1001030103_,6029331675,4.88E+15,爱好读书的历史大妈,0,0,1,nan,nan,下班后还为上班的事发愁可是没有额外工资的哦！,2016/9/17 17:49
90,5669459648,工资,2023/3/8 14:03,https://weibo.com/5669459648/MwmLerDDm?refer_flag=1001030103_,5669459648,4.88E+15,兔子小姐yu,0,0,0,nan,nan,我不生产工资我只是工资的搬运工,2015/8/6 13:59
14,5423004360,工资,2023/3/9 14:57,https://weibo.com/5423004360/MwwxFrBMQ?refer_flag=1001030103_,5423004360,4.88E+15,xianyu1pc,1,2,1,工资和加班成正比,工资和加班成正比,如果顺利换到工作之后我就有工资了，虽然不多，但是还是满足了，希望一切顺利，到时候收几张小卡降临一下自己哈哈哈哈（我这个没别的，就是爱奖励自己）,2014/12/16 10:48
177,5670638136,工资,2023/3/9 14:53,https://weibo.com/5670638136/MwwvXnQK1?refer_flag=1001030103_,5670638136,4.88E+15,好想要一台棱镜,0,1,0,nan,nan,马上就快实习一个月了这份工作好适合摆烂啊一个人待着不用social空了可以写写论文同事也蛮好相处的每天下班回家做饭或者吃妈妈做的饭吃完就拿点小零食边吃边躺在床上摆烂某种意义上也算是一种理想的生活吧马上就要发工资啦虽然不多但是已经想好要怎么用啦这个月立个小fl,2015/8/6 23:01
260,2652501674,工资,2023/3/9 14:38,https://weibo.com/2652501674/MwwpN35Lq?refer_flag=1001030103_,2652501674,4.88E+15,APlasticine,0,2,1,nan,nan,在小公司待着的后果就是领一份工资干几个人干的活真的快忙死了[苦涩][苦涩][苦涩]为什么感觉整个公司就我最忙啊无语死了[泪][泪][泪],2012/1/5 9:54
7,6618688282,工资,2023/3/9 14:32,https://weibo.com/6618688282/Mwwniwy1W?refer_flag=1001030103_,6618688282,4.88E+15,沧海余夫,0,0,0,nan,nan,单位真的是，加班的时候讲要有格局，we'reteam，大家共进退，发工资的时候怎么就三六九等，各论各的了[白眼],2018/8/1 13:08
29,1874247241,工资,2023/3/9 14:32,https://weibo.com/1874247241/Mwwne3vcs?refer_flag=1001030103_,1874247241,4.88E+15,苇子的池塘,0,0,0,nan,nan,来自@MIOYOUNHEUN_CONCisslinson紫薯芋圆随后我就找了一家比较轻松的工资过的去的公司入职了，主要是虽然有更高工资的地方，但是管理严格,2010/11/25 10:32
94,6419970352,工资,2023/3/9 14:29,https://weibo.com/6419970352/Mwwm4xPWD?refer_flag=1001030103_,6419970352,4.88E+15,有钱美女幸运星,0,0,0,nan,nan,拿着微薄的工资去激情下单了[微笑],2017/12/6 13:38
192,6259119775,工资,2023/3/9 14:27,https://weibo.com/6259119775/MwwlgiOUk?refer_flag=1001030103_,6259119775,4.88E+15,_欲语于雨,0,0,0,nan,nan,说好的存钱，结果工资全花光[悲伤],2017/5/26 23:13
107,5955365313,工资,2023/3/9 14:20,https://weibo.com/5955365313/Mwwijqqj5?refer_flag=1001030103_,5955365313,4.88E+15,不做日白梦,0,0,0,nan,nan,拿着最低的工资，干着最累的活[吐],2016/6/14 18:20
309,3854519588,工资,2023/3/9 14:18,https://weibo.com/3854519588/MwwhL9TDX?refer_flag=1001030103_,3854519588,4.88E+15,原来我是奶茶啊hhh,0,0,0,nan,nan,这种不求上进的佛系上班的感觉真好看谁不顺眼就骂谁谁不好就骂谁也不用讨好领导不愿意干就是不干到点上班到点下班下班手机就不接单位的电话绝不内卷只有这样上班才能变得快乐不让自己受委屈也不用当舔狗当一天和尚撞一天钟上一天班有一天的工资最近上班真的变得快乐多了#佛系上班#,2013/10/16 16:10
